{
  "protocol_version": "2.0.0-draft",
  "message_kind": "transcode.request",
  "message_id": "99999999-9999-7999-8999-000000000132",
  "sent_at": "2029-12-31T23:50:00.000Z",
  "audience": "worker:runpod-test",
  "key_id": "test-hub2wk-k1",
  "identity": {
    "org_uuid": "11111111-1111-7111-8111-111111111111",
    "video_uuid": "22222222-2222-7222-8222-222222222222",
    "owning_cell_id": "cell-test-a",
    "placement_epoch": 7,
    "lifecycle_revision": 3,
    "attempt_id": "33333333-3333-7333-8333-333333333333",
    "dispatch_id": "44444444-4444-7444-8444-444444444444"
  },
  "source": {
    "source_id": "66666666-6666-7666-8666-666666666666",
    "location_id": "aaaaaaaa-aaaa-7aaa-8aaa-aaaaaaaaaaaa",
    "object_key": "test/sources/source-0001.mp4",
    "size_bytes": 734003200,
    "etag": "test-etag-0001"
  },
  "output": {
    "location_id": "bbbbbbbb-bbbb-7bbb-8bbb-bbbbbbbbbbbb"
  },
  "profile": {
    "id": "test-h264-sdr",
    "version": 1,
    "sha256": "abababababababababababababababababababababababababababababababab"
  },
  "renditions": [
    "720p",
    "480p",
    "360p"
  ],
  "encryption": {
    "mode": "none",
    "media_key_id": "77777777-7777-7777-8777-777777777777"
  },
  "limits": {
    "max_source_bytes": 10737418240,
    "max_source_duration_ms": 14400000,
    "max_output_bytes": 21474836480,
    "max_artifact_count": 25209,
    "max_wall_time_ms": 3600000
  },
  "claim": {
    "bootstrap_token": "TESTONLYbootstrapTokenNotASecret00000000000",
    "expires_at": "2030-01-01T00:50:00.000Z"
  }
}
